{
  "title": {
    "main_title": "Together",
    "subtitle": "The Healing Power of Human Connection in a Sometimes Lonely World"
  },
  "authors": [
    {
      "first_name": "Vivek",
      "last_name": "Murthy",
      "description": "The 19th Surgeon General of the US under Barack Obama"
    }
  ],
  "isbn": "",
  "reason_for_reading": "Pleasure",
  "publication_date": "",
  "original_language": "ENG",
  "genre": "non-fiction;",
  "start_date": "01-24-2021",
  "finish_date": "01-30-2021",
  "pages": 372,
  "word_count": 116746,
  "flesh_kincaid_reading_level": 78.89,
  "synopsis": "",
  "key_takeaway": "",
  "key_ideas": [
    {
      "topic_heading": "",
      "text": ""
    }
  ],
  "counter_ideas": [
    {
      "topic heading": "",
      "text": ""
    }
  ],
  "quotes": [
    {
      "quote": "",
      "page": ""
    }
  ],
  "vocabulary": [
    {
      "word": "",
      "part_of_speech": "",
      "pronunciation": "",
      "definition": ""
    }
  ],
  "review": "",
  "review_score": 3.0,
  "other_reading": [
    {
      "book_title": "",
      "author": ""
    }
  ]
}