{
  "title": {
    "main_title": "The Tao of Pooh and the Te of Piglet",
    "subtitle": "The principles of Taoism demonstrated by Winnie the Pooh and Piglet"
  },
  "authors": [
    {
      "first_name": "Benjamin",
      "last_name": "Hoff",
      "description": null
    }
  ],
  "isbn": "978-1405293778",
  "reason_for_reading": "pleasure",
  "publication_date": "2019-09-05",
  "original_language": "ENG",
  "genre": "non-fiction;self-help;taoism;philosophy",
  "start_date": "2021-02-04",
  "finish_date": "2021-02-07",
  "pages": 424,
  "word_count": 65000,
  "flesh_kincaid_reading_level": 70,
  "synopsis": "",
  "key_takeaway": "",
  "key_ideas": [],
  "counter_ideas": [],
  "quotes": [],
  "vocabulary": [],
  "review": "",
  "review_score": 2,
  "other_reading": [
    {
      "book_title": "",
      "author": ""
    }
  ]
}